{"$id":"urn:gammaray:phase0:finding-observation:draft-1","$schema":"https://json-schema.org/draft/2020-12/schema","additionalProperties":false,"description":"One observation is one scan/assessment result about one finding (D03 section 9.3). supporting_raw_refs is capped at 64 PER OBSERVATION (approved, task P0-D03-002); an evidence set above the cap is quarantined with a typed reason, never truncated (D03 section 9.3). Observation history is retained without a lifetime cap and read through bounded, paginated retrieval.","properties":{"confidence":{"maximum":1,"minimum":0,"type":"number"},"event_ids":{"items":{"pattern":"^[0-9a-f]{64}$","type":"string"},"maxItems":64,"type":"array","uniqueItems":true},"evidence_set_hash":{"pattern":"^[0-9a-f]{64}$","type":"string"},"feed":{"additionalProperties":false,"properties":{"fetched_at":{"format":"date-time","type":"string"},"id":{"maxLength":128,"minLength":1,"type":"string"},"revision":{"maxLength":128,"minLength":1,"type":"string"}},"required":["id","revision"],"type":"object"},"finding_id":{"pattern":"^[0-9a-f]{64}$","type":"string"},"observation_id":{"pattern":"^[0-9a-f]{64}$","type":"string"},"observed_at":{"format":"date-time","type":"string"},"parser":{"additionalProperties":false,"properties":{"id":{"maxLength":128,"minLength":1,"type":"string"},"version":{"maxLength":64,"minLength":1,"type":"string"}},"required":["id","version"],"type":"object"},"result":{"enum":["present","absent_verified","unknown"]},"rule_id":{"maxLength":128,"minLength":1,"pattern":"^[A-Za-z0-9][A-Za-z0-9_.:-]*$","type":"string"},"rule_version":{"maxLength":64,"minLength":1,"pattern":"^\\S+$","type":"string"},"scan":{"additionalProperties":false,"properties":{"coverage":{"enum":["complete","partial","unknown"]},"scan_id":{"maxLength":256,"minLength":1,"pattern":"^\\S+$","type":"string"},"scan_key":{"maxLength":512,"minLength":1,"pattern":"^\\S+$","type":"string"},"source_id":{"maxLength":128,"minLength":1,"type":"string"}},"required":["scan_key","coverage"],"type":"object"},"supporting_raw_refs":{"items":{"maxLength":128,"minLength":1,"pattern":"^[!-~]+$","type":"string"},"maxItems":64,"minItems":1,"type":"array","uniqueItems":true}},"required":["observation_id","finding_id","observed_at","rule_id","rule_version","parser","scan","result","evidence_set_hash","supporting_raw_refs"],"title":"GammaRay finding observation record (PROPOSED, task P0-D03-002)","type":"object"}